{
  "$schema": "https://json-schema.org/draft/2020-12/schema",
  "$id": "https://onetool.beycom.online/schemas/console/instance-snapshot.schema.json",
  "type": "object",
  "required": ["id", "cwd", "repo_root", "allowed_roots", "status", "message_count", "started_at", "updated_at", "runtime"],
  "properties": {
    "id": { "type": "string", "minLength": 1 },
    "cwd": { "type": "string", "minLength": 1 },
    "repo_root": { "type": "string", "minLength": 1 },
    "config_path": { "type": ["string", "null"] },
    "config_dir": { "type": ["string", "null"] },
    "allowed_roots": { "type": "array", "items": { "type": "string" } },
    "status": { "type": "string" },
    "message_count": { "type": "integer", "minimum": 0 },
    "started_at": { "type": "string", "pattern": "^\\d{4}-\\d{2}-\\d{2}T\\d{2}:\\d{2}:\\d{2}" },
    "updated_at": { "type": "string", "pattern": "^\\d{4}-\\d{2}-\\d{2}T\\d{2}:\\d{2}:\\d{2}" },
    "runtime": { "type": "object" }
  },
  "additionalProperties": false
}

